Question,Slide number,Content
Which fundamental scientific concept is explicitly provided alongside a traditional Chinese translation to explain the inspiration behind these generative algorithms?,104,"Artificial Intelligence
Knowledge Wen-Huang Cheng National Taiwan University wenhuang@csie.ntu.edu.tw One Chinese inscription is written."
"In the 2022 framework that successfully identifies a piece of living room furniture in its case study, what specific filtering mechanism is applied directly to the external encyclopedia text?",151,"Example: KAT [NAACL 2022]
External Source (., Wikipedia) Sliding Window Knowledge (., Entity: Description) Trainera: trainera is traditional boat of the. Answering Model Answer: couch Source: KAT: Knowledge Augmented Transformer for Vision-and-Language, NAACL, 2022."
"For the newly rewritten detailed descriptions fixing the flawed anatomy metadata, what specific material is the anatomical structure described as being constructed from?",140,"Method 2: Architecture-Focused Models
Core idea: Dynamic adjust to handle the absence of certain modality. electronic health record 37 Source: DrFuse: Learning Disentangled Representation for Clinical Multi-Modal Fusion with Missing Modality and Modal Inconsistency, AAAI, 2024."
How many independent feature extraction frameworks are fundamentally required to enable the cross-sensory functions of advanced foundational models?,134,"Modality Missing
Maintaining performance when modality is missing Source: Deep Multimodal Learning with Missing Modality: Survey, TMLR, 2026."
Which section of the empirical evaluations specifically analyzes the incorporation of spoken audio into the seven billion parameter framework?,127,"Experiments: Setting (2)
Performance with Speech Integration at 7B Scale"
"During the self-teaching phase of external utility integration, what mathematical criterion is used to discard unhelpful function executions?",95,"The system prompt for automatic curriculum (3/3)
"
Why is it stated that the reverse trajectory of matter shares the identical normal probability curve as its blending trajectory during brief observational windows?,38,"Text to Image Generation with Diffusion Based Models
Diffusion Process If we look at the movement of single molecule on very short time scale, it follows Gaussian distribution. Since the direction of mixing and the opposite direction are the same in very short time, the opposite direction also follows Gaussian distribution. 38 Source: https://sgvr.kaist.ac.kr/~sungeui/CG/Slides/slides_24/CS380_Talk3_Diffusion.pdf"
How do traditional reasoning entities function when interacting with their internalized frameworks of information?,175,"Classic logic-based agents
agents that reason by operating on logic-based representations of knowledge"
"Through the recursive synthesis of discrete environmental observations gathered in bottom-tier nodes, what specific personal conviction does the system ultimately deduce for the simulated academic researcher?",102,"Stanford AI Village [UIST 2023] Episodic memory of experience
reflection tree for Klaus Mueller. The agent observations of the world, represented in the leaf nodes, are recursively synthesized to derive Klaus self-notion that he is highly dedicated to his research."
How is the specialized task of converting visual content into descriptive linguistic formats formally defined in this presentation?,54,"The RECAP Framework
This work proposes to relabel the corpus with improved captions that are auto-generated by custom I2T (image-to-text) model, so as to increase sample efficiency and allow vision-language model to better understand the relations between captions and images."
What upcoming 2025 conference presentation outlines a consolidated methodology allowing a solitary system to handle both segmented text and fluid visual data?,128,"Experiments: Setting (3)
Transfusion [ICLR 2025] introduces unified framework that enables single transformer model to process both discrete text and continuous image modalities."
"In the context of the newly introduced 2025 autonomous navigation system, what serves as the core foundational basis for its strategic maneuvering?",64,"Example:
Policy World Model for Driving [NeurIPS 2025] Comparison of video world models for autonomous driving Conventional video world models typically serve as data engines for stimulation in pixel space. Unified world models perform video generation and planning as separate tasks. The proposed policy world model performs planning based on the learned world knowledge."
Where can I find the visual samples that demonstrate the creation of novel pictures from scratch by the model exposed to half a trillion data pieces?,64,"Example:
Policy World Model for Driving [NeurIPS 2025] Comparison of video world models for autonomous driving Conventional video world models typically serve as data engines for stimulation in pixel space. Unified world models perform video generation and planning as separate tasks. The proposed policy world model performs planning based on the learned world knowledge."
What specific constraint is placed on the initial processing layer to guarantee it only synthesizes information from historical elements?,101,"Stanford AI Village [UIST 2023] Episodic memory of experience
The memory stream comprises large number of observations that are relevant and irrelevant to the agent current situation. Retrieval identifies subset of these observations that should be passed to the language model to condition its response to the situation."
Which section provides concrete numerical evidence regarding the massive scale of data required to train a recent vision-capable algorithm compared to its text-only predecessor?,118,"The two main challenges
Demanding larger datasets and computations For example, Chameleon (released by Meta, 2024) is trained on 9.2 trillion training tokens (including image tokens) to match LLaMA2, which is trained on 2 trillion training tokens for text performance. Inherent differences in how different modalities are processed In the feature space (across layers), PCA results show the distinct clustering by modality (text, speech, image)."
"In the 2024 TMLR paper concerning procedural memory, what specific mechanism is responsible for modifying a newly generated program before it gets permanently archived as a capability?",88,"Voyager [TMLR 2024] A procedural memory of skills
"
"Looking at the final, most complete iteration of the four-part workflow diagram for the gaming agent, what specific internal checking mechanism is introduced directly below the 'Refine Program' step?",85,"A decision-making example (1/4)
The agent is able to correct its reasoning trace and execute sequence of actions in concise manner!"
"In the visual processing pipeline that determines the dental count of a feline, what mathematical operation is applied directly after evaluating the token-level embeddings?",17,"Positional Encoding
Source: Attention is all you need, NeurIPS, 2017."
"Into what specific digital components of an image do the algorithms inject randomized statistical interference, inspired by thermodynamic behavior?",39,"Text to Image Generation with Diffusion Based Models
Diffusion Process Just as we viewed the molecule motion as Gaussian-distributed noise We add Gaussian-distributed noise to the pixel 39 Source: https://sgvr.kaist.ac.kr/~sungeui/CG/Slides/slides_24/CS380_Talk3_Diffusion.pdf"
"If we choose not to train a parameter matrix for mapping sequence positions, what alternative approach is explicitly proposed to meet the system's requirements?",20,"Positional Encoding
Options for pos(.) 1. Learn lookup table: Learn parameters to use for pos for [0,) Lookup table contains parameters. 2. Design fixed function with the desiderata Source: Attention is all you need, NeurIPS, 2017."
"What core design philosophy inspires the proposed 2025 framework to break down highly complex visual prompts into smaller, sequential steps?",67,"Example:
RT-2: Vision-Language-Action Models [PLMR 2023]"
"When segregating network weights by data type, which specific architectural components bypass the shared embedding and are maintained independently?",48,"Multimodal Embedding Spaces
Multimodal embedding spaces are typically learned by collecting large amounts of paired multimodal data from the Internet, often images and text, and learning encoders for each modality using pairwise similarity objective."
"Which specific typographical symbol is utilized in the provided index to denote a two-way, mutually dependent relationship between statements?",180,"Proposition Symbols used to represent a proposition
"
"In the comparative case study analyzing cinema ticket sales, what exact financial figure is retrieved from the web for the individual who ultimately grossed less?",173,"Case study (bad case): 2/2
"
How do traditional simulation engines differ from the newly proposed integrated architecture in the context of autonomous navigation systems?,64,"Example:
Policy World Model for Driving [NeurIPS 2025] Comparison of video world models for autonomous driving Conventional video world models typically serve as data engines for stimulation in pixel space. Unified world models perform video generation and planning as separate tasks. The proposed policy world model performs planning based on the learned world knowledge."
"Which section is specifically titled to denote the overarching structural blueprint of an autonomous entity, illustrating its operational hierarchies without indicating that any components will be deferred to a later date?",65,"Example:
Policy World Model for Driving [NeurIPS 2025] Overview of the Policy World Model"
"When aligning different types of data formats into a unified representation space, what specific optimization goal is used to train the respective representation extractors on massive web datasets?",48,"Multimodal Embedding Spaces
Multimodal embedding spaces are typically learned by collecting large amounts of paired multimodal data from the Internet, often images and text, and learning encoders for each modality using pairwise similarity objective."
What proposed alternative methodology is suggested for implementing sequence location embeddings if one wishes to avoid utilizing a trainable parameter matrix?,19,"Positional Encoding
Options for pos(.) 1. Learn lookup table: Learn parameters to use for pos for [0,) Lookup table contains parameters. Desiderata of pos(.): 1. It should output unique encoding for each time-step (word position in sentence) 2. Distance between any two time-steps should be consistent across sentences with different lengths. 3. Our model should generalize to longer sentences without any efforts. Its values should be bounded. 4. It must be deterministic. Source: Attention is all you need, NeurIPS, 2017."
"During the iterative improvement loop of the text-based reinforcement framework, what exact condition must be met for the interactive trials to finally terminate?",80,"The Reflexion process
Initialization The Actor produces trajectory "" by interacting with the environment. The Evaluator then produces score r"" which is computed as #=M$(""), where # is only scalar reward for trial t. The Self-Reflection model analyzes the set of {"", r""} to produce summary sr"" which is stored in the memory mem, where sr# is verbal experience feedback for trial t. Repeat The Actor, Evaluator, and Self-Reflection model work together through trials in loop until the Evaluator deems sr# to be correct. Note that after each trial t, sr#, is appended mem. 80"
What is the fundamental distinction between a mere syntactic link combining two statements and the overarching relationship where the truth of one entire set of information guarantees the truth of another?,194,"For example, if α: “It is a Tuesday in January” and β: “It is January,” then we know that α ⊨β. If it is true that it is a Tuesday in January, we also know that it is January.
Entailment is different from implication. Implication is logical connective between two propositions. Entailment, on the other hand, is relation that means that if all the information in is true, then all the information in is true."
"During the initial phase of the experimental setups, at what precise percentage of completion was the multi-goal learning process recorded?",126,"Experiments: Setting (1)
Note: MoT at 55.8% training steps"
At what point do we shift our focus from the macroscopic layout of the stacked generative modules to explicitly examining the internal workings of a single unit?,17,"Positional Encoding
Source: Attention is all you need, NeurIPS, 2017."
What specific factors make the optimization of standard unified-architecture algorithms particularly difficult when blending multiple distinct data types simultaneously?,118,"The two main challenges
Demanding larger datasets and computations For example, Chameleon (released by Meta, 2024) is trained on 9.2 trillion training tokens (including image tokens) to match LLaMA2, which is trained on 2 trillion training tokens for text performance. Inherent differences in how different modalities are processed In the feature space (across layers), PCA results show the distinct clustering by modality (text, speech, image)."
What specific data transformation steps are identified as mandatory prerequisites for converting standard text-generating networks into fully functional autonomous decision-makers?,8,"Sequence to Sequence Generation with Transformer Based Models
Input: Sequence x1,., xT Output: Sequence y1,., yT Transformer is an encoder-decoder architecture: An encoder (neural network) analyzes the input and builds an intermediate representation (.context vector) of it; decoder (neural network) analyzes the intermediate representation and creates an output. 8 Source: https://huggingface.co/blog/encoder-decoder"
Why does answering a query about the final academic schedule date for a specific Taiwanese university require more than just the model's basic internal parameters?,146,"Explicit knowledge
Let consider one task for now: question answering (QA).: What is 1 + 2?: 3: What is the last day of classes for the next semester at National Taiwan University? Requires external knowledge"
Which specific internal components are cited as the driving force behind the cross-format capabilities of advanced language architectures?,73,"Toolformer: Language Models Can Teach Themselves to Use Tools [NeurIPS 2023]
Key steps: Given an input text, we first sample position and corresponding API call candidates c1i, c2i,., cki. We then execute these API calls and filter out all calls which do not reduce the loss Li over the next tokens. All remaining API calls are interleaved with the original text, resulting in new text."
What specific software developed by a major AI laboratory is mentioned as an example of creating lifelike visuals from written descriptions?,36,"Text to Image Generation with Diffusion Based Models
Text to Image Generation Generating realistic images from text descriptions by OpenAI DALL 2 36 Source: Hierarchical Text-Conditional Image Generation with CLIP Latents, arXiv, 2022."
What are the three specific sub-topics listed under the introductory section concerning artificial intelligence entities that can interact with their environment?,1,"Artificial Intelligence
Preliminaries and AI Agent Basics Wen-Huang Cheng National Taiwan University wenhuang@csie.ntu.edu.tw One Chinese inscription is written."
"Under a strictly constrained computational budget, what scaling principle explains why building a massively scaled network architecture executed for fewer training iterations yields superior quality compared to a smaller dense network trained extensively?",118,"The two main challenges
Demanding larger datasets and computations For example, Chameleon (released by Meta, 2024) is trained on 9.2 trillion training tokens (including image tokens) to match LLaMA2, which is trained on 2 trillion training tokens for text performance. Inherent differences in how different modalities are processed In the feature space (across layers), PCA results show the distinct clustering by modality (text, speech, image)."
"In the troubleshooting example involving a hearing-impaired performer, what specific sci-fi character's appearance was mistakenly retrieved due to a poorly phrased query?",138,"Method 1: Modality Imputation
AVR: Audio-Visual Relation-aware diffusion model depicts the diffusion and reverse process of concatenated features between real features, while represents the reverse process of features where the pseudo feature and the real feature are concatenated."
What structural representation is used to recursively process basic observations to conclude that a specific persona has a strong commitment to their academic work?,102,"Stanford AI Village [UIST 2023] Episodic memory of experience
reflection tree for Klaus Mueller. The agent observations of the world, represented in the leaf nodes, are recursively synthesized to derive Klaus self-notion that he is highly dedicated to his research."
Which academic publication from a 2022 journal is referenced as the foundation for scaling network capacities to a trillion parameters via simplified sparsity?,118,"The two main challenges
Demanding larger datasets and computations For example, Chameleon (released by Meta, 2024) is trained on 9.2 trillion training tokens (including image tokens) to match LLaMA2, which is trained on 2 trillion training tokens for text performance. Inherent differences in how different modalities are processed In the feature space (across layers), PCA results show the distinct clustering by modality (text, speech, image)."
"In the experiment comparing simple scaling against solver-driven feedback, by exactly how many percentage points does the two-sample approach on the smaller base network beat the heavily optimized setup that utilizes a model ten times its size?",126,"Experiments: Setting (1)
Note: MoT at 55.8% training steps"
"Based on the analogy of microscopic particle movement, what specific mathematical perturbation is applied directly to the individual elements of a digital picture?",37,"Text to Image Generation with Diffusion Based Models
Diffusion Process Diffusion models are inspired by non-equilibrium thermodynamics. For small fraction of the time, it is difficult to determine whether particles are moving in the direction of mixing or in the opposite direction. 37 Source: https://sgvr.kaist.ac.kr/~sungeui/CG/Slides/slides_24/CS380_Talk3_Diffusion.pdf One Chinese inscription is written."
"When a network architecture separates its learning weights based on the type of sensory input, which specific sub-components of the network layer are isolated from one another, apart from the initial token embeddings?",23,"Self-Attention Layer
Outputs: Context vectors: (shape:) Inputs: Input vectors: (shape:) 23 Source: https://cs231n.stanford.edu/slides/2022/lecture_11_ruohan.pdf"
What empirical evidence shows that leveraging self-face reflection achieves higher accuracy on two specific facial datasets than just applying standard mirror transformation techniques to a ResNet-18 baseline?,142,"Effective Feature Extraction for FER
Facial Chirality Psychological studies show that emotional faces are asymmetric. Powell,.Ryan, and James.Schirillo. ""Asymmetrical facial expressions in portraits and hemispheric laterality: literature review."" Laterality 14.6 (2009): 545-572. However, face image and its reflection are with exact the same expression. Ling Lo, HongXia Xie, Hong-Han Shuai and Wen-Huang Cheng, Facial Chirality: Using Self-Face Reflection to Learn Discriminative Features for Facial Expression Recognition, ICME 2021 (Best Paper Award)"
How exactly does the proposed algorithm mathematically separate the asymmetrical characteristics from the actual emotion within the hidden representation layers?,142,"Effective Feature Extraction for FER
Facial Chirality Psychological studies show that emotional faces are asymmetric. Powell,.Ryan, and James.Schirillo. ""Asymmetrical facial expressions in portraits and hemispheric laterality: literature review."" Laterality 14.6 (2009): 545-572. However, face image and its reflection are with exact the same expression. Ling Lo, HongXia Xie, Hong-Han Shuai and Wen-Huang Cheng, Facial Chirality: Using Self-Face Reflection to Learn Discriminative Features for Facial Expression Recognition, ICME 2021 (Best Paper Award)"
"How is the categorization of tangible domain information structured to contrast rapid, immediate comprehension with deliberate, sluggish cognition?",215,"Remarks
Real-world knowledge plays vital role in human intelligence. Physical World Knowledge Taxonomy Horizon Deep Semantics (slow-thinking) Planning Temporal Relation Situation/Event (Image) Action (Video) Spatial Relation Object Affordance Surface Semantics (fast-thinking) Object Properties Object Permanence Dynamics Static Dynamic"
How are the final conclusions regarding the weather status and a cancelled social meeting mathematically derived from the initial three behavioral premises?,196,"! If it didn't rain, Amy visited Bobby today. "" Amy visited Bobby or Carson today, but not both. # Amy visited Carson today.
$ Amy did not visit Bobby today. % It rained today. (4)(5) are inferred from (1)(2)(3)."
"During a step-by-step trial to identify an actor with hearing loss in a famous animated comedy, what specific sci-fi character did the system mistakenly retrieve information about before correcting its strategy?",138,"Method 1: Modality Imputation
AVR: Audio-Visual Relation-aware diffusion model depicts the diffusion and reverse process of concatenated features between real features, while represents the reverse process of features where the pseudo feature and the real feature are concatenated."
Why might an AI need to rely on specific character markers to access external utilities like computational or lookup services?,1,"Artificial Intelligence
Preliminaries and AI Agent Basics Wen-Huang Cheng National Taiwan University wenhuang@csie.ntu.edu.tw One Chinese inscription is written."
Which part of the third experimental setup details the empirical outcomes for optimizing multiple distinct goals simultaneously?,131,"Experiments: Setting (3)
Multi-objective training performance in MoT"
Under what precise meteorological and physical location circumstances does the presented rule about staying inside during wet weather become logically invalid?,187,"When the antecedent is true, the whole implication is true in the case that the consequent is true • i.e., if it is raining and I’m indoors, then the sentence “if it is raining, then I’m indoors” is true.
When the antecedent is true, the implication is false if the consequent is false., if outside while it is raining, then the sentence If it is raining, then indoors is false."
What linguistic metaphor is used to describe the ultimate goal of training separate vision and text processing modules together?,49,"Multimodal Embedding Spaces
Multimodal learning The multi-modal nature of MLLMs is powered by two encoder models (Text encoder and Image encoder) trained to speak the same language."
"During the internal success-checking phase, the gaming agent realizes it cannot build the optical viewing instrument. What exact missing raw material prevents the completion of this specific recipe?",83,"A decision-making example
Task: examine the mug with the desklamp"
"Given that a simulated character records a massive amount of both useful and useless information over time, what specific process is used to isolate the exact data needed to shape its reaction to a given scenario?",99,"Stanford AI Village [UIST 2023] Episodic memory of experience
99 Source: Generative Agents: Interactive Simulacra of Human Behavior, UIST, 2023."
Why is it inherently difficult for artificial entities to autonomously generate constructive critiques of their own past performance?,78,"Transforming Experience into Long-Term Memory
For agents, however, generating useful reflective feedback is challenging since it requires: good understanding of where the model made mistakes; the ability to generate summary containing actionable insights for improvement."
How is the forecasting of the subsequent environmental state mathematically represented on the slide that also establishes the explicit necessity for input and output discretization?,37,"Text to Image Generation with Diffusion Based Models
Diffusion Process Diffusion models are inspired by non-equilibrium thermodynamics. For small fraction of the time, it is difficult to determine whether particles are moving in the direction of mixing or in the opposite direction. 37 Source: https://sgvr.kaist.ac.kr/~sungeui/CG/Slides/slides_24/CS380_Talk3_Diffusion.pdf One Chinese inscription is written."
What two specific capabilities must be achieved regarding inputs and outputs in order to consider large multimodal systems as functional autonomous entities?,113,"Multimodal Knowledge in AI Agents
The integration of multimodal understanding is essential for developing sophisticated generalist AI agents. In the context of AI agents, knowledge refers to the processing and representation of diverse data types (such as text, images, and speech) within unified MLLM framework."
Which section simply supplements the lecture with an external media hyperlink to explain universally valid formulas versus situationally dependent ones using traditional Chinese terms?,93,"The system prompt for automatic curriculum (1/3)
(The list of question-answer pairs represents the additional context.)"
