Question,Slide number,Content
"If the primary mechanism that relates different parts of an input to each other ignores the sequence in which the data arrives, what is the stated reason for needing an extra mechanism to track structural arrangement?",26,"Self-Attention Layer
Permutation equivariant Self-attention layer does not care about the orders of the inputs! Problem: How can we encode ordered sequences like language or spatially ordered image features? That why we need positional encoding! 26 Source: https://cs231n.stanford.edu/slides/2022/lecture_11_ruohan.pdf"
What is the stated end goal of utilizing hierarchical conditional models in the context of interpreting descriptive language?,195,"inference
the process of deriving new sentences from old ones"
"During extremely brief temporal windows, why does analyzing the physical blending of matter become highly ambiguous regarding its trajectory?",37,"Text to Image Generation with Diffusion Based Models
Diffusion Process Diffusion models are inspired by non-equilibrium thermodynamics. For small fraction of the time, it is difficult to determine whether particles are moving in the direction of mixing or in the opposite direction. 37 Source: https://sgvr.kaist.ac.kr/~sungeui/CG/Slides/slides_24/CS380_Talk3_Diffusion.pdf One Chinese inscription is written."
What explicit capability does the core routing module grant the network to ensure it prioritizes the most crucial elements of the source sequence during output creation?,9,"Transformer Based Models
Transformer is an encoder-decoder architecture with core component attention mechanism. Attention allows the model to focus on the most relevant parts of the input sequence when generating the output. 9 Source: https://huggingface.co/blog/encoder-decoder"
How do the lecture materials distinguish between verifiable facts stored in databases and the underlying patterns algorithms absorb from massive corpora?,198,"Model Checking A way to infer new knowledge
based on existing knowledge"
"When comparing self-evaluation techniques for binary classification, exactly how many distinct challenges were analyzed to chart the cumulative proportion of successes?",86,"More Reflection, Greater Success
AlfWorld performance across 134 tasks showing cumulative proportions of solved tasks using self- evaluation techniques of (Heuristic) and (GPT) for binary classification. ReAct [ICLR 2023]"
"In a directional conditional statement linking two events, what formal terminology is introduced to identify the initial premise and its resulting outcome?",186,"Implication represent a structure of “if P then Q”
For example: if: It is raining and: indoors then means If it is raining, then indoors. In the case of implies, is called the antecedent and is called the consequent."
"In a compartmentalized network structure, what specific mechanism is responsible for directing individual pieces of input data to the appropriate processing sub-network?",23,"Self-Attention Layer
Outputs: Context vectors: (shape:) Inputs: Input vectors: (shape:) 23 Source: https://cs231n.stanford.edu/slides/2022/lecture_11_ruohan.pdf"
What specific mathematical value is assigned to the compatibility scores of upcoming sequence positions to successfully blind the model to them?,18,"Positional Encoding
Desiderata of pos(.): 1. It should output unique encoding for each time-step (word position in sentence) 2. Distance between any two time-steps should be consistent across sentences with different lengths. 3. Our model should generalize to longer sentences without any efforts. Its values should be bounded. 4. It must be deterministic. Source: Attention is all you need, NeurIPS, 2017."
"Which slide initially outlines the four foundational criteria for sequence mapping functions, strictly before suggesting any concrete ways to implement them?",174,"Some of the following slides credit to:
Harvard University-CS 50: Artificial Intelligence in Python"
What specific 2022 publication from the Journal of Machine Learning Research is cited as a foundational reference for achieving extreme algorithmic scale through streamlined sparsity?,118,"The two main challenges
Demanding larger datasets and computations For example, Chameleon (released by Meta, 2024) is trained on 9.2 trillion training tokens (including image tokens) to match LLaMA2, which is trained on 2 trillion training tokens for text performance. Inherent differences in how different modalities are processed In the feature space (across layers), PCA results show the distinct clustering by modality (text, speech, image)."
"In the proposed technique utilizing a relation-aware generative model, which specific diagram segment illustrates the backward mapping steps when combining synthesized representations with actual ones?",8,"Sequence to Sequence Generation with Transformer Based Models
Input: Sequence x1,., xT Output: Sequence y1,., yT Transformer is an encoder-decoder architecture: An encoder (neural network) analyzes the input and builds an intermediate representation (.context vector) of it; decoder (neural network) analyzes the intermediate representation and creates an output. 8 Source: https://huggingface.co/blog/encoder-decoder"
"According to the cited 2021 academic paper on the virtual mock-up environment, what exact type of high-level, word-driven strategies is the system designed to teach the simulated actors?",87,"Voyager [TMLR 2024] A procedural memory of skills
Objective: Leveraging MLLMs (., OpenAI APIs) for improved game mechanics understanding Innovative Features: Introduction of automatic curriculum and skill library Automatic curriculum proposes increasingly complex tasks Skill library serves as learning and evolution basis Iterative prompting mechanism refines the program and incorporates it into the skill library as new skill 87 Source: Voyager: An Open-Ended Embodied Agent with Large Language Models, Transactions on Machine Learning Research (TMLR), 2024."
In what specific journal is the 2026 comprehensive review published that discusses how systems can keep working effectively even when one type of sensory input is completely unavailable?,140,"Method 2: Architecture-Focused Models
Core idea: Dynamic adjust to handle the absence of certain modality. electronic health record 37 Source: DrFuse: Learning Disentangled Representation for Clinical Multi-Modal Fusion with Missing Modality and Modal Inconsistency, AAAI, 2024."
"In the hypothetical deduction puzzle detailing visits among three individuals, what is the ultimately deduced weather condition for that specific day?",196,"! If it didn't rain, Amy visited Bobby today. "" Amy visited Bobby or Carson today, but not both. # Amy visited Carson today.
$ Amy did not visit Bobby today. % It rained today. (4)(5) are inferred from (1)(2)(3)."
"In an unsuccessful trial detailing an economic projection, what exact percentage increase did the system attempt to apply to a base figure of $1.71 trillion?",172,"Case study (bad case): 1/2
"
Which specific 2024 academic publication demonstrates a system capable of bridging numerous distinct data formats?,166,"The Dyn-VQA dataset
Comparison of knowledge-seeking VQA datasets The annotation of fast or slow is determined by whether the updating occurs on yearly basis."
What exact numerical value is assigned to the compatibility metrics of upcoming sequence elements to mathematically prevent the network from looking ahead?,21,"Positional Encoding
Positional Encoding Visualization (0) (1) (2) (3)=0=1=2=3 Source: https://erdem.pl/2021/05/understanding-positional-encoding-in-transformers"
Which part of the presentation provides practical demonstrations of modifying and altering existing visual content using the seven billion parameter system?,67,"Example:
RT-2: Vision-Language-Action Models [PLMR 2023]"
Where can one find the high-level visual summarization or structural outline specifically designated for the newly proposed 2025 autonomous driving framework?,65,"Example:
Policy World Model for Driving [NeurIPS 2025] Overview of the Policy World Model"
"When analyzing the trajectory of an individual chemical particle over a brief interval, what specific statistical pattern does both its forward blending and reverse trajectory exhibit?",37,"Text to Image Generation with Diffusion Based Models
Diffusion Process Diffusion models are inspired by non-equilibrium thermodynamics. For small fraction of the time, it is difficult to determine whether particles are moving in the direction of mixing or in the opposite direction. 37 Source: https://sgvr.kaist.ac.kr/~sungeui/CG/Slides/slides_24/CS380_Talk3_Diffusion.pdf One Chinese inscription is written."
What is the exact mathematical summation formula used to compute the final output representations after the probability weights have been determined?,44,"Denoising Diffusion Models
Reverse denoising process: Removing noise We can directly calculate (xt1xt) because it involves complex data-related calculations. Instead, we model the reverse process with neural network to estimate (xt1xt). Model 44 Source: https://lilianweng.github.io/posts/2021-07-11-diffusion-models/"
What type of raw information is typically gathered in massive quantities to build shared representation environments for different formats?,48,"Multimodal Embedding Spaces
Multimodal embedding spaces are typically learned by collecting large amounts of paired multimodal data from the Internet, often images and text, and learning encoders for each modality using pairwise similarity objective."
"Why do the native metadata tags scraped from web datasets often fail as high-quality training data for vision-language models, particularly when describing images of humans?",51,"Observations [Google Research 2023]
Open-web datasets used to train open text-to-image models suffer from significant issues. To be specific, the captions in the LAION dataset, used to train vision-language models, come from alt HTML tags (Alttext) and often describes only narrow aspect of the image, neglecting significant visual details. For example, an image of person can have as Alttext the name of the person and the name of the photographer, but not description of their appearance, their clothes, their position, or the background. Source: Picture is Worth Thousand Words: Principled Recaptioning Improves Image Generation, arXiv, 2023."
"Which specific slide explicitly provides the structural blueprint of the internal components for the simulated interactive human personas, rather than just introducing the episodic memory concept?",100,"Stanford AI Village [UIST 2023] Episodic memory of experience
The agent architecture 100 Source: Generative Agents: Interactive Simulacra of Human Behavior, UIST, 2023."
"Could you provide the visual samples demonstrating the system's ability to modify existing pictures, specifically using a seven-billion parameter network that was processed on half a trillion tokens?",133,"Image editing examples from a 7B Transfusion MoT model trained with 0.5T tokens
"
How is the conceptual analogy of a chemical particle's random trajectory practically applied to the fundamental visual elements of a digital picture?,38,"Text to Image Generation with Diffusion Based Models
Diffusion Process If we look at the movement of single molecule on very short time scale, it follows Gaussian distribution. Since the direction of mixing and the opposite direction are the same in very short time, the opposite direction also follows Gaussian distribution. 38 Source: https://sgvr.kaist.ac.kr/~sungeui/CG/Slides/slides_24/CS380_Talk3_Diffusion.pdf"
Which section illustrates the two-tiered cognitive hierarchy of autonomous systems while explicitly noting that the mechanisms for retaining information and utilizing external utilities will be covered in future coursework?,215,"Remarks
Real-world knowledge plays vital role in human intelligence. Physical World Knowledge Taxonomy Horizon Deep Semantics (slow-thinking) Planning Temporal Relation Situation/Event (Image) Action (Video) Spatial Relation Object Affordance Surface Semantics (fast-thinking) Object Properties Object Permanence Dynamics Static Dynamic"
What is the specific mathematical formula used to compute the compatibility between the query and key vectors before normalizing them into probability weights?,156,"RA-VQA-v2 [NeurIPS 2023]
Relevance score between the query and the document is computed by aggregating the fine-grained relevance at token level with late interaction mechanism. The answer generator takes the text query, the image, and the retrieved documents as input, generating one candidate answer per retrieved document. The answer with the highest joint probability is selected."
"Is there an example showing how models dynamically adapt to the absence of certain inputs by using clinical records, such as digital patient medical files, from a recent 2024 conference?",140,"Method 2: Architecture-Focused Models
Core idea: Dynamic adjust to handle the absence of certain modality. electronic health record 37 Source: DrFuse: Learning Disentangled Representation for Clinical Multi-Modal Fusion with Missing Modality and Modal Inconsistency, AAAI, 2024."
"During the phase where corruption is systematically injected into the data, what mathematical parameters characterize the perturbations added across multiple time increments?",43,"Denoising Diffusion Models
Forward diffusion process: Introducing noise In the forward diffusion process, the small Gaussian noise is incrementally added to the distribution over steps, resulting in series of increasingly noisy samples. mean variance 2 43 Source: https://lilianweng.github.io/posts/2021-07-11-diffusion-models/"
What are the fundamental limitations of standard temporal windows compared to a system that successfully archives past skills and knowledge?,76,"Memory
Stores experience, skills, knowledge. Persist over new experience Append-only Limited context Limited attention Do not persist over new tasks"
What phrase is used to define a declarative statement about reality when expressed within a formal system for representing information?,178,"sentence
an assertion about the world in knowledge representation language"
"To strictly block the neural architecture from peeking ahead at upcoming sequence elements during generation, what specific numerical abstraction is assigned to the forward-looking evaluation metrics?",17,"Positional Encoding
Source: Attention is all you need, NeurIPS, 2017."
Which section surprisingly brings up the architectural design for visual tasks immediately following the citation of the foundational 2017 neural network paper?,23,"Self-Attention Layer
Outputs: Context vectors: (shape:) Inputs: Input vectors: (shape:) 23 Source: https://cs231n.stanford.edu/slides/2022/lecture_11_ruohan.pdf"
"Under a constrained computational allocation, what is the stated preferred strategy regarding network size and the duration of the pretraining phase?",122,"Experiments: Setting (1)
MoT (pre-training at 7B scale) is compared against two baselines: dense transformer model Mixture-of-Experts model with 4 experts (MoE-4x) This plots the training steps required by MoT and MoE-4x to reach equivalent loss values as the dense model."
Which upcoming academic paper is highlighted for successfully bridging the gap between step-by-step linguistic data and fluid visual inputs within a singular algorithmic framework?,49,"Multimodal Embedding Spaces
Multimodal learning The multi-modal nature of MLLMs is powered by two encoder models (Text encoder and Image encoder) trained to speak the same language."
Which specific visual recognition framework is referenced as an example when discussing the technique designed to selectively hide certain sequence elements during the learning phase?,32,"Masked Self-Attention Layer
Masked self-attention is used to ensure that the model does not attend to some of the tokens in the input sequence during training or generation. The architecture of Vision Transformer (ViT) 32 Source: Attention is All You Need, NIPS. 2017."
What specific literature reference is cited to support the psychological concept that human expressions of emotion are not perfectly symmetrical on both sides of the face?,142,"Effective Feature Extraction for FER
Facial Chirality Psychological studies show that emotional faces are asymmetric. Powell,.Ryan, and James.Schirillo. ""Asymmetrical facial expressions in portraits and hemispheric laterality: literature review."" Laterality 14.6 (2009): 545-572. However, face image and its reflection are with exact the same expression. Ling Lo, HongXia Xie, Hong-Han Shuai and Wen-Huang Cheng, Facial Chirality: Using Self-Face Reflection to Learn Discriminative Features for Facial Expression Recognition, ICME 2021 (Best Paper Award)"
"To demonstrate the massive computational cost of handling multiple sensory inputs, what specific token counts are compared between a 2024 Meta release and a standard text-focused language model?",118,"The two main challenges
Demanding larger datasets and computations For example, Chameleon (released by Meta, 2024) is trained on 9.2 trillion training tokens (including image tokens) to match LLaMA2, which is trained on 2 trillion training tokens for text performance. Inherent differences in how different modalities are processed In the feature space (across layers), PCA results show the distinct clustering by modality (text, speech, image)."
"During the emotion recognition pipeline, at what specific mathematical juncture does the system split the representation of physical facial asymmetry away from the core emotional signal?",142,"Effective Feature Extraction for FER
Facial Chirality Psychological studies show that emotional faces are asymmetric. Powell,.Ryan, and James.Schirillo. ""Asymmetrical facial expressions in portraits and hemispheric laterality: literature review."" Laterality 14.6 (2009): 545-572. However, face image and its reflection are with exact the same expression. Ling Lo, HongXia Xie, Hong-Han Shuai and Wen-Huang Cheng, Facial Chirality: Using Self-Face Reflection to Learn Discriminative Features for Facial Expression Recognition, ICME 2021 (Best Paper Award)"
"Despite isolating the computational weights for different sensory inputs, what core mechanistic feature remains universally shared across the entire network?",17,"Positional Encoding
Source: Attention is all you need, NeurIPS, 2017."
What is the primary difference in how an AI retrieves verified facts from structured external databases compared to the innate understanding it develops during massive text corpus training?,114,"Multimodal Knowledge in AI Agents
Two types of knowledge: implicit and explicit Implicit knowledge is typically what large-scale language models encapsulate after being trained on vast amounts of text data. Explicit knowledge is structured and can be directly queried, such as the information found in knowledge bases or databases, which was traditionally used to enhance AI reasoning capabilities by referencing verifiable external resources."
"In the visual comparisons demonstrating the relabeling framework's superiority over the baseline, what unusual arboreal obstacle is an automobile depicted navigating through?",152,"REVIVE [NeurIPS 2022]: Regional Visual Representation
Source: REVIVE: Regional Visual Representation Matters in Knowledge-Based Visual Question Answering, NeurIPS, 2022."
"When attempting to assemble an optical viewing instrument in the sandbox game, why was the attempt marked as a failure despite the inventory showing three copper ingots?",83,"A decision-making example
Task: examine the mug with the desklamp"
What are the three distinct evaluation configurations used to test the proposed segregated architecture's effectiveness across different inputs and optimization goals?,120,"Mixture-of-Transformers Architecture (MoT)
The proposed MoT decouples the parameters by modality while maintaining global self-attention."
How is the framework from a recent 2025 conference structured to simultaneously comprehend unbroken visual streams alongside step-by-step written language sequences inside a solitary network?,17,"Positional Encoding
Source: Attention is all you need, NeurIPS, 2017."
"In the flowchart depicting the self-critique framework, which specific component is tasked with housing both the long-term and short-term experiential records?",77,"Transforming Experience into Long-Term Memory
Humans learn from prior mistakes to perform better on task. Self-reflection is mechanism to build long-term memory of self-reflective experiences which allows humans to identify their own errors and self-suggest lessons to learn from their mistakes over time. One Chinese inscription is written."
Could someone clarify the exact monetary expense and the total volume of textual fragments analyzed during the live run of the fully automated research deployment?,108,"AI Weekly
https://thunderbolt215.github.io/ArtiMuse-project/"
Which specific computational step distinguishes itself by calculating relationships based on the final outputs of the previous module rather than evaluating its own internal data?,71,"Tool Use
MLLMs predict model-specific tokens (w!, w"",., w#) w#$! Sometimes, invoking 'tool calls' is necessary to accomplish the 'prediction' task. Special tokens can be exploited to invoke tool calls for Search engine, calculator, etc. Task-specific models (translation) APIs"
"Which slide highlights the ultimate objective of adapting broad, internet-scale information over to the realm of physical machine manipulation?",69,"Example:
RT-2: Vision-Language-Action Models [PLMR 2023] Transfer Web Knowledge to Robotic Control"
Which specific university course is explicitly acknowledged as the origin of the instructional material being presented?,93,"The system prompt for automatic curriculum (1/3)
(The list of question-answer pairs represents the additional context.)"
"Which section establishes the initial dimensional shapes and variable names for both incoming and outgoing data sequences, completely prior to introducing any internal calculations?",25,"Self-Attention Layer
Outputs: Context vectors: (shape:) Operations: Query vectors:=xWq Key vectors:=xWk Value vectors:=xWv Alignment: ei,=qj ki/Attention:=softmax Output: yj=ai, vi Inputs: Input vectors: (shape:) 25 Source: https://cs231n.stanford.edu/slides/2022/lecture_11_ruohan.pdf"
"When dealing with factual domains that shift rapidly, why is a single-pass fetching strategy considered inadequate, and what must the system do instead to ensure accuracy?",160,"Dynamic questions
Since the context knowledge of such question updates frequently, the retrieved content may be mixed with outdated and newer knowledge that is difficult to distinguish. This requires mARG methods to flexibly plan additional retrievals based on feedback from current retrieved content for further comprehension, rather than merely one-time retrieval."
"For frameworks that avoid using direct visual embeddings, what is the required intermediate step used to process an image before searching the database?",158,"Challenges with mRAG
Heuristic mRAG methods typically predefined fixed retrieval processes, suffering from challenges: (1) Non-adaptive Retrieval Queries Referring to the fixed retrieval processes and query structures of heuristic mRAG methods (2) Overloaded Retrieval Queries Referring to heuristic mRAG methods merely format single query by concatenating textual descriptions of objects in images with input questions"
"If the simulated character does not have a weapon readily available in its inventory during an encounter with an undead enemy, what specific asynchronous function is triggered to create one?",210,"People Rooms Weapons
One card of each category is picked at random and put it in an envelope, and it is up to the participants to uncover whodunnit."
How does the system filter the vast array of collected environmental observations before feeding them into the core language engine to shape its reactions?,73,"Toolformer: Language Models Can Teach Themselves to Use Tools [NeurIPS 2023]
Key steps: Given an input text, we first sample position and corresponding API call candidates c1i, c2i,., cki. We then execute these API calls and filter out all calls which do not reduce the loss Li over the next tokens. All remaining API calls are interleaved with the original text, resulting in new text."
"Where is the fundamental discrepancy between standard foundation predictors and interactive autonomous systems first mathematically detailed, prior to introducing any input conversion requirements?",63,"MLLMs as Agent Models
MLLMs predict model-specific tokens (w!, w"",., w#) w#$! AI Agents predict observation-action sequences Policy model: World model: (o!, a!, o"", a"",., o#) a# (o!, a!, o"", a"",., o#, a#) o#$!"
"When categorizing the pace of information change within the referenced evaluation benchmark, what specific time interval dictates whether the data is flagged as 'rapid' versus 'gradual'?",166,"The Dyn-VQA dataset
Comparison of knowledge-seeking VQA datasets The annotation of fast or slow is determined by whether the updating occurs on yearly basis."
What linguistic metaphor explains how dual processing modules coordinate to power large-scale vision-language architectures?,67,"Example:
RT-2: Vision-Language-Action Models [PLMR 2023]"
