Question,Slide number,Content
Why do we intentionally block the architecture from evaluating certain elements of the sequence during both the learning phase and the text generation phase?,32,"Masked Self-Attention Layer
Masked self-attention is used to ensure that the model does not attend to some of the tokens in the input sequence during training or generation. The architecture of Vision Transformer (ViT) 32 Source: Attention is All You Need, NIPS. 2017."
"When attempting to restore incomplete audio-visual streams, how is the backward noise-reduction step visually differentiated when it combines authentic input with artificially generated substitute data?",138,"Method 1: Modality Imputation
AVR: Audio-Visual Relation-aware diffusion model depicts the diffusion and reverse process of concatenated features between real features, while represents the reverse process of features where the pseudo feature and the real feature are concatenated."
"Based on a cited 2022 NAACL paper, what are the three distinct streams of information required to successfully predict an answer when combining visual comprehension with outside databases?",149,"Knowledge-based VQA
Knowledge-based VQA takes three different information sources to predict the answer: input visual information (image), input question, and the external knowledge. Source: KAT: Knowledge Augmented Transformer for Vision-and-Language, NAACL, 2022."
"What specific flaw is introduced when a system clumsily merges the user's prompt with the written descriptions of visual elements to form a single, giant search string?",158,"Challenges with mRAG
Heuristic mRAG methods typically predefined fixed retrieval processes, suffering from challenges: (1) Non-adaptive Retrieval Queries Referring to the fixed retrieval processes and query structures of heuristic mRAG methods (2) Overloaded Retrieval Queries Referring to heuristic mRAG methods merely format single query by concatenating textual descriptions of objects in images with input questions"
"In the introduced benchmark collection for information-seeking tasks, what exact temporal metric is used as the threshold to categorize a fact's evolution speed as either sluggish or rapid?",166,"The Dyn-VQA dataset
Comparison of knowledge-seeking VQA datasets The annotation of fast or slow is determined by whether the updating occurs on yearly basis."
"What specific phrase describes the logical validity of a conditional rule when its triggering premise simply does not occur, thereby neutralizing the rule entirely?",188,"However, when the antecedent is false, the implication is always true, regardless of the consequent. • Logically, we can’t learn anything from an implication (P → Q) if the antecedent (P) is false. • Looking at our example, if it is not raining, the implication doesn’t say anything about whether I’m indoors or not. I could be an indoors type and never walk outside, even when it is not raining, or I could be an outdoors type and be outside all the time when it is not raining. • When the antecedent is false, we say that the implication is trivially true.
"
"When a network teaches itself to invoke external computing utilities, what specific mathematical metric dictates whether a candidate invocation is ultimately kept or discarded before being interwoven into the output?",174,"Some of the following slides credit to:
Harvard University-CS 50: Artificial Intelligence in Python"
"When comparing generative baseline models for tracking extreme meteorological events, what visual indicator is explicitly utilized to point out unwanted artifacts or physically unrealistic anomalies?",46,"Example: Stable Diffusion
46 Source: High-Resolution Image Synthesis with Latent Diffusion Models, CVPR, 2022."
"Is the structural design of the generating module fundamentally different from the analyzing module, or do they share most of their architecture?",11,"Example: Language Translation with Transformers
Autoregressive generation is the inference-time procedure of iteratively calling model with its own generated outputs, given few initial inputs. 11 Source: https://huggingface.co/blog/encoder-decoder"
"When charting the cumulative success rates of different self-assessment methodologies for binary categorization, exactly how many distinct challenges were analyzed in the provided graph?",86,"More Reflection, Greater Success
AlfWorld performance across 134 tasks showing cumulative proportions of solved tasks using self- evaluation techniques of (Heuristic) and (GPT) for binary classification. ReAct [ICLR 2023]"
"In the showcased examples of integrated functional calls, what precise mathematical division is demonstrated alongside its percentage result?",89,"A Running Example (1/4)
"
"In the hierarchical memory diagram for a specific villager, what core self-identity is ultimately derived from recursively synthesizing the foundational nodes of his worldly observations?",102,"Stanford AI Village [UIST 2023] Episodic memory of experience
reflection tree for Klaus Mueller. The agent observations of the world, represented in the leaf nodes, are recursively synthesized to derive Klaus self-notion that he is highly dedicated to his research."
What is the initial mechanical setup required in the tangible mystery game before players can actively begin deducing the culprit's identity?,210,"People Rooms Weapons
One card of each category is picked at random and put it in an envelope, and it is up to the participants to uncover whodunnit."
Which specific 2022 academic manuscript involving latent representations is referenced regarding the creation of visual content from linguistic cues?,49,"Multimodal Embedding Spaces
Multimodal learning The multi-modal nature of MLLMs is powered by two encoder models (Text encoder and Image encoder) trained to speak the same language."
What concept describes the ability to flexibly map between completely unrestricted input and output combinations?,125,"What is a Mixture of Experts (MoE)?
Source: Switch Transformers: Scaling to Trillion Parameter Models with Simple and Efficient Sparsity, JMLR, 2022."
"When setting up the initial instructions for generating increasingly difficult gaming objectives, what specific format is used to supply supplementary contextual information to the system?",93,"The system prompt for automatic curriculum (1/3)
(The list of question-answer pairs represents the additional context.)"
"In the introduction to the procedural learning system for the block-building game, which specific commercial company's programming interfaces are explicitly credited for improving the grasp of gameplay rules?",87,"Voyager [TMLR 2024] A procedural memory of skills
Objective: Leveraging MLLMs (., OpenAI APIs) for improved game mechanics understanding Innovative Features: Introduction of automatic curriculum and skill library Automatic curriculum proposes increasingly complex tasks Skill library serves as learning and evolution basis Iterative prompting mechanism refines the program and incorporates it into the skill library as new skill 87 Source: Voyager: An Open-Ended Embodied Agent with Large Language Models, Transactions on Machine Learning Research (TMLR), 2024."
"In the section discussing logic challenges, which slide illustrates a scenario where a participant creates a hidden sequence of hues and the opponent attempts to figure it out based on numeric feedback?",214,"Mastermind
Another type of puzzle that can be solved using propositional logic is Mastermind game. In this game, player one arranges colors in certain order, and then player two has to guess this order. Each turn, player two makes guess, and player one gives back number, indicating how many colors player two got right. Let simulate game with four colors."
What specific term is mathematically equated to the process of generating outputs without any guiding prompts or context?,11,"Example: Language Translation with Transformers
Autoregressive generation is the inference-time procedure of iteratively calling model with its own generated outputs, given few initial inputs. 11 Source: https://huggingface.co/blog/encoder-decoder"
"In the simulated block-world environment, when the automated entity attempts to manufacture an optical viewing instrument but fails due to missing inventory, what specific geological resource does the internal critique suggest retrieving from underground?",14,"The Transformer Encoder Block (1/5)
Made up of encoder blocks. Source: https://cs231n.stanford.edu/slides/2022/lecture_11_ruohan.pdf"
At which specific machine learning conference was the framework handling dozens of distinct tasks officially presented?,118,"The two main challenges
Demanding larger datasets and computations For example, Chameleon (released by Meta, 2024) is trained on 9.2 trillion training tokens (including image tokens) to match LLaMA2, which is trained on 2 trillion training tokens for text performance. Inherent differences in how different modalities are processed In the feature space (across layers), PCA results show the distinct clustering by modality (text, speech, image)."
What generic mathematical variable is utilized in the diagrams to represent the total quantity of stacked processing units comprising the primary analysis framework?,124,"What is a Mixture of Experts (MoE)?
Architecture MoE consists of two main elements: Sparse MoE layers are used instead of dense feed-forward network (FFN) layers. MoE layers have certain number of experts (. 8), where each expert is neural network. gate network or router, that determines which tokens are sent to which expert. Source: https://huggingface.co/blog/moe"
"During the initial practical attempt of the household chore, what specific sequential error did the virtual entity realize it made regarding the order of finding the light source versus the drinkware?",83,"A decision-making example
Task: examine the mug with the desklamp"
"In the scripting implementation of the logical tracker, how is the behavioral constraint that a person cannot simultaneously visit two different friends structurally formulated?",85,"A decision-making example (1/4)
The agent is able to correct its reasoning trace and execute sequence of actions in concise manner!"
"During the process of guessing missing sensory information, what exact type of data substitute is pumped out by the generator designed to analyze relationships between the available inputs?",137,"Method 1: Modality Imputation
RMM: Relation-aware Missing Modal generator generating pseudo features 1. 2. 3."
"During the looping phase of a trial, what exact condition must be satisfied for the interactive cycle between the generation, scoring, and summarization components to finally terminate?",80,"The Reflexion process
Initialization The Actor produces trajectory "" by interacting with the environment. The Evaluator then produces score r"" which is computed as #=M$(""), where # is only scalar reward for trial t. The Self-Reflection model analyzes the set of {"", r""} to produce summary sr"" which is stored in the memory mem, where sr# is verbal experience feedback for trial t. Repeat The Actor, Evaluator, and Self-Reflection model work together through trials in loop until the Evaluator deems sr# to be correct. Note that after each trial t, sr#, is appended mem. 80"
"When setting up the initial instructions for the module responsible for proposing increasingly difficult objectives, what specific formatting structure is noted as representing the supplementary background information?",93,"The system prompt for automatic curriculum (1/3)
(The list of question-answer pairs represents the additional context.)"
"Within the architecture of the self-adjusting orchestrator, which specific component is responsible for analyzing the fetched data and sending real-world reactions back to the main coordinator?",165,"The OmniSearch framework
The planning agent is the core module that formulates sub-questions and plans the subsequent retrieval action based on real-world feedback (., retrieved content or solver output). Actual retrieval action is execute by the retriever. Then, sub- question solver generates feedback on sub-question based on the retrieval content and update it to the planner."
I'm reviewing the mathematical function used to inject sequence order into attention-based architectures. What are the four specific design requirements this mathematical function must satisfy to be considered effective?,26,"Self-Attention Layer
Permutation equivariant Self-attention layer does not care about the orders of the inputs! Problem: How can we encode ordered sequences like language or spatially ordered image features? That why we need positional encoding! 26 Source: https://cs231n.stanford.edu/slides/2022/lecture_11_ruohan.pdf"
"When dealing with facts that update very quickly, why is a single, initial search step considered inadequate, and what must the system rely on to separate old from new facts?",160,"Dynamic questions
Since the context knowledge of such question updates frequently, the retrieved content may be mixed with outdated and newer knowledge that is difficult to distinguish. This requires mARG methods to flexibly plan additional retrievals based on feedback from current retrieved content for further comprehension, rather than merely one-time retrieval."
"In the human-annotated examples demonstrating different descriptive lengths, what specific decorative element is mentioned as being placed alongside the chilled beverage?",83,"A decision-making example
Task: examine the mug with the desklamp"
Why does a scenario involving weather conditions and a specific day of the week logically result in exactly four potential truth-value configurations?,191,"P: It is raining.
: It is Tuesday. {=true,=false} model In fact, there are more possible models, say 22=4 because we have two propositions."
How is the production-phase mechanism formally defined when a model iteratively consumes its own previous predictions to continue building a translation?,11,"Example: Language Translation with Transformers
Autoregressive generation is the inference-time procedure of iteratively calling model with its own generated outputs, given few initial inputs. 11 Source: https://huggingface.co/blog/encoder-decoder"
What is the primary performance benefit of using a specialized vision-to-language module to rewrite the training labels for large datasets?,54,"The RECAP Framework
This work proposes to relabel the corpus with improved captions that are auto-generated by custom I2T (image-to-text) model, so as to increase sample efficiency and allow vision-language model to better understand the relations between captions and images."
"When creating shared representation structures, what are the most common pairs of sensory inputs sourced from online repositories?",48,"Multimodal Embedding Spaces
Multimodal embedding spaces are typically learned by collecting large amounts of paired multimodal data from the Internet, often images and text, and learning encoders for each modality using pairwise similarity objective."
How do we conceptually describe the mechanism that stops positional arrays from gaining information from positions that occur later in the sequence?,26,"Self-Attention Layer
Permutation equivariant Self-attention layer does not care about the orders of the inputs! Problem: How can we encode ordered sequences like language or spatially ordered image features? That why we need positional encoding! 26 Source: https://cs231n.stanford.edu/slides/2022/lecture_11_ruohan.pdf"
What is the fully expanded terminology for the standard artificial neural network layer explicitly defined at the very end of the architectural diagram breakdown?,25,"Self-Attention Layer
Outputs: Context vectors: (shape:) Operations: Query vectors:=xWq Key vectors:=xWk Value vectors:=xWv Alignment: ei,=qj ki/Attention:=softmax Output: yj=ai, vi Inputs: Input vectors: (shape:) 25 Source: https://cs231n.stanford.edu/slides/2022/lecture_11_ruohan.pdf"
"In the case comparing the commercial success of two film industry figures, what was the specific estimated financial revenue attributed to the winning individual?",58,"Results
"
Why do we have to rely on an artificial neural architecture to approximate the step-by-step reconstruction phase instead of just computing the exact probabilities directly?,44,"Denoising Diffusion Models
Reverse denoising process: Removing noise We can directly calculate (xt1xt) because it involves complex data-related calculations. Instead, we model the reverse process with neural network to estimate (xt1xt). Model 44 Source: https://lilianweng.github.io/posts/2021-07-11-diffusion-models/"
What specific mechanism decides the exact pathway that individual pieces of data take when navigating the specialized sub-networks?,31,"The Transformer Decoder Block (3)
Most of the network is the same the transformer encoder. Masked Self-attention only interacts with past inputs."
"If we are working with a strict computing allowance, what is the recommended strategy regarding the size of our architecture versus how long we run the learning phase?",70,"Agent Architecture
Level 1: Using MLLM to act (reasoning) (acting) Level 2: Using MLLM to reason to act Tool Use Memory 70 Source: https://rdi.berkeley.edu/llm-agents/f24"
"How is the system structured to execute multiple independent tracking processes simultaneously, specifically noting a numerical skip in the sequence of the named sub-components?",27,"Multi-Head Self-Attention Layer
Multiple self-attention heads in parallel Self-attention of Head0 Self-attention of Head1 Self-attention of Head3. 27 Source: https://cs231n.stanford.edu/slides/2022/lecture_11_ruohan.pdf"
"During the automated introspection loop designed to build long-term memory, how does the output structure from the scoring module fundamentally differ in data format from the output produced by the introspection module?",80,"The Reflexion process
Initialization The Actor produces trajectory "" by interacting with the environment. The Evaluator then produces score r"" which is computed as #=M$(""), where # is only scalar reward for trial t. The Self-Reflection model analyzes the set of {"", r""} to produce summary sr"" which is stored in the memory mem, where sr# is verbal experience feedback for trial t. Repeat The Actor, Evaluator, and Self-Reflection model work together through trials in loop until the Evaluator deems sr# to be correct. Note that after each trial t, sr#, is appended mem. 80"
"When discussing existing vehicular simulation paradigms, which specific methodology is described as functioning primarily as an information generator within the visual realm?",64,"Example:
Policy World Model for Driving [NeurIPS 2025] Comparison of video world models for autonomous driving Conventional video world models typically serve as data engines for stimulation in pixel space. Unified world models perform video generation and planning as separate tasks. The proposed policy world model performs planning based on the learned world knowledge."
What is the exact name of the architecture presented in a recent venue that achieves broad adaptability across unconstrained input-output mapping configurations?,120,"Mixture-of-Transformers Architecture (MoT)
The proposed MoT decouples the parameters by modality while maintaining global self-attention."
What specific variable is used to denote the total count of repeating structural sub-units that make up the primary processing architecture?,27,"Multi-Head Self-Attention Layer
Multiple self-attention heads in parallel Self-attention of Head0 Self-attention of Head1 Self-attention of Head3. 27 Source: https://cs231n.stanford.edu/slides/2022/lecture_11_ruohan.pdf"
"During the tabular evaluation of states, what is the justification for invalidating a scenario where the specific day arrives without precipitation, yet the anticipated jogging activity does not occur?",196,"! If it didn't rain, Amy visited Bobby today. "" Amy visited Bobby or Carson today, but not both. # Amy visited Carson today.
$ Amy did not visit Bobby today. % It rained today. (4)(5) are inferred from (1)(2)(3)."
What specific formatting flaw causes search requests to become too burdensome in rigidly structured information-seeking pipelines?,158,"Challenges with mRAG
Heuristic mRAG methods typically predefined fixed retrieval processes, suffering from challenges: (1) Non-adaptive Retrieval Queries Referring to the fixed retrieval processes and query structures of heuristic mRAG methods (2) Overloaded Retrieval Queries Referring to heuristic mRAG methods merely format single query by concatenating textual descriptions of objects in images with input questions"
Which branch of physics involving systems lacking macroscopic balance serves as the foundational inspiration for the discussed generative algorithms?,37,"Text to Image Generation with Diffusion Based Models
Diffusion Process Diffusion models are inspired by non-equilibrium thermodynamics. For small fraction of the time, it is difficult to determine whether particles are moving in the direction of mixing or in the opposite direction. 37 Source: https://sgvr.kaist.ac.kr/~sungeui/CG/Slides/slides_24/CS380_Talk3_Diffusion.pdf One Chinese inscription is written."
"During the multi-step economic calculation scenario, what is the exact estimated monetary figure for the East Asian country's economic output in the year directly preceding the target forecasting year?",164,"OmniSearch
Taiwan South Korea Which one of them has the highest GDP?"
"For the 2023 framework that generates one candidate reply per fetched document, what specific strategy is used to combine granular, word-piece level connections to evaluate overall match quality?",156,"RA-VQA-v2 [NeurIPS 2023]
Relevance score between the query and the document is computed by aggregating the fine-grained relevance at token level with late interaction mechanism. The answer generator takes the text query, the image, and the retrieved documents as input, generating one candidate answer per retrieved document. The answer with the highest joint probability is selected."
"When evaluating the system's performance on the dataset where either visual or acoustic inputs are omitted, what specific acronym represents the foundational architecture adopted as the comparison baseline?",127,"Experiments: Setting (2)
Performance with Speech Integration at 7B Scale"
"When integrating external databases to augment generation, what are the two distinct workflows used to translate the initial visual input into a format suitable for searching?",158,"Challenges with mRAG
Heuristic mRAG methods typically predefined fixed retrieval processes, suffering from challenges: (1) Non-adaptive Retrieval Queries Referring to the fixed retrieval processes and query structures of heuristic mRAG methods (2) Overloaded Retrieval Queries Referring to heuristic mRAG methods merely format single query by concatenating textual descriptions of objects in images with input questions"
"Under the comparative analysis of vehicular autonomy paradigms, which specific approach is noted for treating the creation of visual sequences and the strategizing of movements as completely decoupled processes?",64,"Example:
Policy World Model for Driving [NeurIPS 2025] Comparison of video world models for autonomous driving Conventional video world models typically serve as data engines for stimulation in pixel space. Unified world models perform video generation and planning as separate tasks. The proposed policy world model performs planning based on the learned world knowledge."
"Following the step-by-step breakdown of the failed first chore attempt, what ultimate conclusion is drawn regarding the agent's capacity to modify its logical progression?",85,"A decision-making example (1/4)
The agent is able to correct its reasoning trace and execute sequence of actions in concise manner!"
"During the extraction of dynamic information for generating visual physics simulations, what specific mathematical transformation is concatenated directly with the network's cross-referencing layers?",23,"Self-Attention Layer
Outputs: Context vectors: (shape:) Inputs: Input vectors: (shape:) 23 Source: https://cs231n.stanford.edu/slides/2022/lecture_11_ruohan.pdf"
How does the framework presented in the 2023 NeurIPS paper transform simple success or failure signals into a format that the multimodal model can actually read and use for its next attempt?,140,"Method 2: Architecture-Focused Models
Core idea: Dynamic adjust to handle the absence of certain modality. electronic health record 37 Source: DrFuse: Learning Disentangled Representation for Clinical Multi-Modal Fusion with Missing Modality and Modal Inconsistency, AAAI, 2024."
"In the detailed diagram outlining an animal biology query, what is the stated count of primary or 'baby' chewing structures typical for a feline?",17,"Positional Encoding
Source: Attention is all you need, NeurIPS, 2017."
The image generation technique that operates by iteratively manipulating Gaussian distributions traces its core theoretical inspiration back to which specific branch of physics?,38,"Text to Image Generation with Diffusion Based Models
Diffusion Process If we look at the movement of single molecule on very short time scale, it follows Gaussian distribution. Since the direction of mixing and the opposite direction are the same in very short time, the opposite direction also follows Gaussian distribution. 38 Source: https://sgvr.kaist.ac.kr/~sungeui/CG/Slides/slides_24/CS380_Talk3_Diffusion.pdf"
