Question,Slide number,Content
"How are in-game discoveries, such as ruling out a specific suspect or certain combinations of rooms and tools, formally appended to the tracking system?",165,"The OmniSearch framework
The planning agent is the core module that formulates sub-questions and plans the subsequent retrieval action based on real-world feedback (., retrieved content or solver output). Actual retrieval action is execute by the retriever. Then, sub- question solver generates feedback on sub-question based on the retrieval content and update it to the planner."
Why exactly does the core processing mechanism require external spatial data to handle ordered elements like natural language or images?,26,"Self-Attention Layer
Permutation equivariant Self-attention layer does not care about the orders of the inputs! Problem: How can we encode ordered sequences like language or spatially ordered image features? That why we need positional encoding! 26 Source: https://cs231n.stanford.edu/slides/2022/lecture_11_ruohan.pdf"
Where can I find the visual diagram that plots the sequence index variables against depth indices represented by the letter k?,21,"Positional Encoding
Positional Encoding Visualization (0) (1) (2) (3)=0=1=2=3 Source: https://erdem.pl/2021/05/understanding-positional-encoding-in-transformers"
"When analyzing the structural similarities between the generative and analytical parts of the architecture, what specific restriction limits the generative component's awareness strictly to historical data?",215,"Remarks
Real-world knowledge plays vital role in human intelligence. Physical World Knowledge Taxonomy Horizon Deep Semantics (slow-thinking) Planning Temporal Relation Situation/Event (Image) Action (Video) Spatial Relation Object Affordance Surface Semantics (fast-thinking) Object Properties Object Permanence Dynamics Static Dynamic"
"In the negative result report regarding mathematical constraint correction, what was the exact success rate of the minimalist strategy that generated just two attempts, ultimately outperforming a massively larger architecture?",131,"Experiments: Setting (3)
Multi-objective training performance in MoT"
"In standard sequence mapping architectures, what alternative two-word phrase is given for the 'intermediate representation' constructed by the analysis network before the output generation begins?",8,"Sequence to Sequence Generation with Transformer Based Models
Input: Sequence x1,., xT Output: Sequence y1,., yT Transformer is an encoder-decoder architecture: An encoder (neural network) analyzes the input and builds an intermediate representation (.context vector) of it; decoder (neural network) analyzes the intermediate representation and creates an output. 8 Source: https://huggingface.co/blog/encoder-decoder"
"In the multi-step search example involving a famous basketball player, what specific physical object is ultimately identified as the symbol of his franchise?",165,"The OmniSearch framework
The planning agent is the core module that formulates sub-questions and plans the subsequent retrieval action based on real-world feedback (., retrieved content or solver output). Actual retrieval action is execute by the retriever. Then, sub- question solver generates feedback on sub-question based on the retrieval content and update it to the planner."
What optimization criterion is primarily utilized when aligning separate feature extractors on massive web-scraped datasets?,118,"The two main challenges
Demanding larger datasets and computations For example, Chameleon (released by Meta, 2024) is trained on 9.2 trillion training tokens (including image tokens) to match LLaMA2, which is trained on 2 trillion training tokens for text performance. Inherent differences in how different modalities are processed In the feature space (across layers), PCA results show the distinct clustering by modality (text, speech, image)."
What does the three-letter acronym representing the fully connected feed-forward network component inside the final encoding module stand for?,9,"Transformer Based Models
Transformer is an encoder-decoder architecture with core component attention mechanism. Attention allows the model to focus on the most relevant parts of the input sequence when generating the output. 9 Source: https://huggingface.co/blog/encoder-decoder"
"In the framework that uses text-based reinforcement to learn from failures, which specific sub-module is responsible for assessing the quality of the generated actions?",79,"Reflexion [NeurIPS 2023]
Reflexion uses verbal reinforcement to help agents learn from prior failings,., converting binary (., success/fail) or scalar feedback from the environment into verbal feedback in the form of textual summary, which is then added as additional context for the MLLM agent in the next episode. Reflexion utilizes three distinct models: Actor: generating text and actions Evaluator: scoring the outputs produced by the Actor Self-Reflection model: generating verbal reinforcement cues to assist the Actor in self-improvement. 79 Source: Reflexion: Language Agents with Verbal Reinforcement Learning, NeurIPS, 2023."
"In the context of replacing standard fully connected structures, what numerical example is provided for the quantity of independent, specialized networks typically utilized?",27,"Multi-Head Self-Attention Layer
Multiple self-attention heads in parallel Self-attention of Head0 Self-attention of Head1 Self-attention of Head3. 27 Source: https://cs231n.stanford.edu/slides/2022/lecture_11_ruohan.pdf"
"During the task of automatically generating textual descriptions for visual data, what specific component is utilized to feed the visual characteristics into the generating sub-network?",36,"Text to Image Generation with Diffusion Based Models
Text to Image Generation Generating realistic images from text descriptions by OpenAI DALL 2 36 Source: Hierarchical Text-Conditional Image Generation with CLIP Latents, arXiv, 2022."
What structural design strategy relies on on-the-fly network adaptations to ensure continuous operation when specific patient medical logs are absent during clinical evaluations?,140,"Method 2: Architecture-Focused Models
Core idea: Dynamic adjust to handle the absence of certain modality. electronic health record 37 Source: DrFuse: Learning Disentangled Representation for Clinical Multi-Modal Fusion with Missing Modality and Modal Inconsistency, AAAI, 2024."
"When diagnosing the quality issues in large-scale internet image-text datasets, what specific physical attributes of human subjects are noted as frequently missing from the original web scraping metadata?",51,"Observations [Google Research 2023]
Open-web datasets used to train open text-to-image models suffer from significant issues. To be specific, the captions in the LAION dataset, used to train vision-language models, come from alt HTML tags (Alttext) and often describes only narrow aspect of the image, neglecting significant visual details. For example, an image of person can have as Alttext the name of the person and the name of the photographer, but not description of their appearance, their clothes, their position, or the background. Source: Picture is Worth Thousand Words: Principled Recaptioning Improves Image Generation, arXiv, 2023."
"At what exact step is the linear transformation formula for the first extraction vector introduced, while the mathematical calculations for the remaining vectors are still kept hidden?",22,"The Transformer Encoder Block (4/5)
Attention attends over all the vectors Add positional encoding Source: https://cs231n.stanford.edu/slides/2022/lecture_11_ruohan.pdf"
Where can I find the web address for the 2022 university lecture slides that were used to illustrate the stacked nature of the generative modules?,174,"Some of the following slides credit to:
Harvard University-CS 50: Artificial Intelligence in Python"
"When the system is tasked with generating descriptions for pictures, how exactly are the visual representations integrated into the generating module?",12,"Example: Image Captioning with Transformers
Image Captioning is the task of describing the content of an image in words. 12 Source: https://eman-lotfy-elrefai.medium.com/5-models-to-use-for-image-captioning-task-59143fb2df6d"
What specific psychological observation about human physical features explains why an original portrait and its mirrored counterpart convey the identical emotional state despite lacking perfect left-right symmetry?,142,"Effective Feature Extraction for FER
Facial Chirality Psychological studies show that emotional faces are asymmetric. Powell,.Ryan, and James.Schirillo. ""Asymmetrical facial expressions in portraits and hemispheric laterality: literature review."" Laterality 14.6 (2009): 545-572. However, face image and its reflection are with exact the same expression. Ling Lo, HongXia Xie, Hong-Han Shuai and Wen-Huang Cheng, Facial Chirality: Using Self-Face Reflection to Learn Discriminative Features for Facial Expression Recognition, ICME 2021 (Best Paper Award)"
What was the exact financial expenditure required to autonomously produce over a hundred and sixty academic manuscripts using a system that processed over twenty billion textual units?,104,"Artificial Intelligence
Knowledge Wen-Huang Cheng National Taiwan University wenhuang@csie.ntu.edu.tw One Chinese inscription is written."
Which specific branch of physics is cited as the foundational inspiration for models that simulate the gradual mixture and separation of particles over infinitesimal periods?,37,"Text to Image Generation with Diffusion Based Models
Diffusion Process Diffusion models are inspired by non-equilibrium thermodynamics. For small fraction of the time, it is difficult to determine whether particles are moving in the direction of mixing or in the opposite direction. 37 Source: https://sgvr.kaist.ac.kr/~sungeui/CG/Slides/slides_24/CS380_Talk3_Diffusion.pdf One Chinese inscription is written."
"In the detailed transcript of the failed household simulation run, what realization does the system come to regarding the sequence of objects it should have interacted with?",100,"Stanford AI Village [UIST 2023] Episodic memory of experience
The agent architecture 100 Source: Generative Agents: Interactive Simulacra of Human Behavior, UIST, 2023."
